[
  {
    "item_id": "asg_f35b5f98822be7ac",
    "source_key": "canvas:101:1",
    "name": "Essay 1",
    "course": "English",
    "status": "missing",
    "first_seen": "2026-03-05T12:00:00Z",
    "last_seen": "2026-03-06T12:00:00Z",
    "due_at": "2026-03-06T12:00:00Z",
    "date": "2026-03-06",
    "severity_label": "high",
    "schema_version": "1.0",
    "engine_version": "0.2.0",
    "source_adapter": "canvas",
    "course_score": 83.0,
    "course_grade": "B"
  },
  {
    "item_id": "asg_810a85aea48a7196",
    "source_key": "canvas:102:2",
    "name": "Quiz 2",
    "course": "Philosophy",
    "status": "due_48h",
    "first_seen": "2026-03-05T12:00:00Z",
    "last_seen": "2026-03-06T12:00:00Z",
    "due_at": "2026-03-07T09:00:00Z",
    "date": "2026-03-07",
    "severity_label": "high",
    "schema_version": "1.0",
    "engine_version": "0.2.0",
    "source_adapter": "canvas",
    "course_score": 72.0,
    "course_grade": "C"
  },
  {
    "item_id": "asg_3e7688a16611236b",
    "source_key": "canvas:101:5",
    "name": "Discussion 4",
    "course": "English",
    "status": "due_7d",
    "first_seen": "2026-03-06T12:00:00Z",
    "last_seen": "2026-03-06T12:00:00Z",
    "due_at": "2026-03-11T18:00:00Z",
    "date": "2026-03-11",
    "severity_label": "medium",
    "schema_version": "1.0",
    "engine_version": "0.2.0",
    "source_adapter": "canvas",
    "course_score": 83.0,
    "course_grade": "B"
  },
  {
    "item_id": "asg_7361626632093e3d",
    "source_key": "canvas:103:3",
    "name": "Lab 3",
    "course": "Health",
    "status": "due_7d",
    "first_seen": "2026-03-05T12:00:00Z",
    "last_seen": "2026-03-06T12:00:00Z",
    "due_at": "2026-03-12T15:00:00Z",
    "date": "2026-03-12",
    "severity_label": "medium",
    "schema_version": "1.0",
    "engine_version": "0.2.0",
    "source_adapter": "canvas",
    "course_score": 88.0,
    "course_grade": "B"
  },
  {
    "item_id": "asg_f0a928fdbe0cf817",
    "source_key": "canvas:102:4",
    "name": "Reflection 1",
    "course": "Philosophy",
    "status": "not_observed",
    "first_seen": "2026-03-05T12:00:00Z",
    "last_seen": "2026-03-05T12:00:00Z",
    "due_at": "2026-03-04T23:59:00Z",
    "date": "2026-03-04",
    "severity_label": "low",
    "schema_version": "1.0",
    "engine_version": "0.2.0",
    "source_adapter": "canvas",
    "course_score": 74.0,
    "course_grade": "C"
  }
]
